date,title,contents
 2022.01.17 16:24,"에스디바이오센서, 美에 또 1,000억 규모 코로나19 키트 공급",서울경제 체외진단 전문기업 에스디바이오센서 137310 는 글로벌 진단업체 A사와 계약을 맺고 미국 정부에 998억원 규모의 코로나19 자가검사키트를 공급하기로 했다고 17일 밝혔다 에스디바이오센서의 키트는 미국 정부가 자국민에게 공급할 키트 중 일부로 온라인 웹사이트를 통해 배포될 예정이다 조 바이든 미국 대통령은 지난 달 5억 개의 키트를 정부가 구입해 무료로 공급하겠다고 발표했다 에스디바이오센서는 앞서 11일에도 미국에 1 008억 원 어치 키트를 공급한다고 밝혔다 에스디바이오센서 키트는 지난 달 24일 미국 식품의약국 FDA 의 긴급사용승인을 받았다 20분 이내 오미크론·델타 변이 등을 포함한 코로나19 바이러스 감염 여부를 빠르게 확인할 수 있는 것이 장점이다
 2022.01.17 15:21,"SD바이오센서, 998억 규모 코로나19 홈테스트 공급계약",에스디바이오센서는 17일 998억원 규모의 코로나19 홈테스트 공급계약을 체결했다고 공시했다 이는 지난해 말 연결기준 매출액 대비 5 92 에 해당한다
 2022.01.03 16:14,"에스디바이오센서, 1387억원 규모 코로나 키트 수출계약 체결",항원 신속진단키트에스디바이오센서는 캐나다 소재 기업과 1억1700만달러 약 1387억원 규모의 코로나19 항원 신속진단키트 공급계약을 체결했다고 3일 밝혔다 수출 제품은 STANDARD Q COVID 19 Ag Nasal with Control’다 이번 계약으로 인한 매출은 2020년 매출인 1조6861억원 대비 8 23 규모다 계약 기간은 내달까지다 종료일은 최종 선적 예정일이며 공급 일정에 따라 변경될 수 있다 박인혁 기자
 2022.01.17 15:08,"에스디바이오센서, 998억원 코로나19 자가검사키트 美 2차 공급",美 정부용 키트로 사용 예정에스디바이오센서는 998억원 규모의 코로나19 자가검사키트를 미국에 공급하는 계약을 체결했다고 17일 밝혔다 지난달 조 바이든 미국 대통령은 오미크론 변이가 빠르게 확산되자 5억개의 코로나19 자가검사키트를 정부가 구입해 자국민에게 무료로 공급하겠다고 발표했다 이번 계약은 美 행정부에서 이달 말부터 공급하기로 한 키트 수량 중 일부에 해당하는 것이다 온라인 웹사이트를 통해 배포될 예정이다 에스디바이오센서는 높은 민감도와 특이도 탁월한 변이 바이러스 검사 유효성 우수한 생산력을 바탕으로 대규모 계약을 수주했다는 설명이다 에스디바이오센서의 코로나19 자가검사키트는 미국 식품의약국 FDA 으로부터 긴급사용승인 EUA 을 획득했다 각각 95 3 와 100 의 민감도와 특이도를 보인다 처방전 없이 구입할 수 있고 20분 이내에 오미크론과 델타 등을 포함한 코로나19 바이러스의 감염 여부를 확인할 수 있다 998억원 규모의 코로나19 자가검사키트는 글로벌 진단업체 A사에 공급된다 에스디바이오센서는 코로나19 자가검사키트의 미국 독점 유통권을 A사에 부여했다 허태영 에스디바이오센서 대표는 사전에 생산 설비를 확충했기에 대규모 코로나19 자가검사키트 공급계약을 체결할 수 있었다 며 에스디바이오센서는 하루 빨리 코로나19가 종식될 수 있도록 최선을 다해 뛰어난 품질의 제품을 신속하게 필요한 국가에 공급하겠다 고 말했다 한민수 기자
 2022.01.12 16:12,"에스디바이오센서, 'SDB 마켓'서 코로나 자가검사키트 등 최대 60% 할인",이데일리 양지윤 기자 에스디바이오센서가 온라인 쇼핑몰에서 최대 60 할인 이벤트를 진행한다 에스디바이오센서 137310 는 온라인 쇼핑몰 SDB 마켓’을 리뉴얼 오픈해 5일간 최대 60 제품 할인 이벤트를 진행한다고 12일 밝혔다 새롭게 리뉴얼한 SDB 마켓은 에스디바이오센서가 직접 운영하는 온라인 쇼핑몰로 혈당측정기 콜레스테롤 분석기 코로나19 자가검사키트와 같은 의료기기를 일반 소비자 대상으로 판매한다 이번 리뉴얼은 최근 오미크론 바이러스로 코로나19 감염자가 급증하는 상황 속 매장과 병원 방문이 어려운 당뇨와 기저질환 환자들이 온라인을 통해 더 빠르고 간편하게 제품을 구매할 수 있도록 진행됐다 에스디바이오센서는 리뉴얼된 SDB 마켓을 통해 좋은 품질의 제품을 제공하는 동시에 소비자들과 적극 소통할 예정이다 에스디바이오센서는 SDB 마켓 리뉴얼을 기념해 오픈 첫 날인 이날부터 16일까지 5일 간 전 제품 할인 이벤트를 진행한다 할인율은 제품마다 다르며 한 번에 6가지 콜레스테롤과 혈당을 측정할 수 있는 스탠다드 리피도케어 분석기’는 최대 60 할인 가격으로 구매 가능하다
 2022.01.12 07:01,"[기업공시 1월 11일]에스디바이오센서, 1,008억 규모 코로나 테스터기 공급계약 등",서울경제 유가증권 ▲STX 자회사 STX마린서비스 채무 57억 원 보증 결정 ▲대우조선해양 오세아니아 지역 선주와 6 561억 원 필드제어설비 1기 공사 수주 ▲크래프톤 케빈 맥스웰 사외이사 일신상 사유로 중도 퇴임 ▲한국특강 정희석 씨가 장내 매도로 지분 2만 9 630주 전량 처분 ▲까뮤이앤씨 013700 한화건설과 93억 원 규모 인스파이어 복합리조트 개발사업 중 PC공사 수주 ▲코오롱인더 120110 장희구 씨 장내 매수로 1 000주 추가 취득 ▲LIG넥스원 079550 방위산업에 관한 착수금 및 중도금 지급 규칙에 의거해 피플웍스 외 7개사에 선급금 184억 원 지급 ▲에스디바이오센서 137310 미국 A사와 1 008억 원 규모 코로나 테스터기 상품 공급계약 공시 불이행으로 불성실 공시법인 지정 예고 코스닥 ▲피엔티 강소쌍성채숙신재료구분유한공사와 568억 원 규모 광학용 필름 생산 관련 설비 계약 체결 ▲현진소재 서울회생법원이 회생절차개시신청 기각 ▲디지캡 파산신청 취하서 제출 ▲신흥에스이씨 종속회사 신흥 SEC EU 채무 277억 원 보증 결정 ▲에이치앤비디자인 바이오 기업 투자 목적 메이슨캑터스 혁신성장 투자조합 2호의 지분 24 50억 원에 취득 ▲넥스트아이 운영자금 목적 22억 원 교환사채권 발행 결정 ▲비에이치아이 현대제철과 208억 원 규모 발전설비 공급계약 체결 ▲케이피에스 APS 리서치회사와 14억 원 규모 OLEDoS 디스플레이장비계약 체결 ▲삼화네트웍스 문화방송과 75억 원 규모 드라마 지금부터 쇼타임 ’ 국내 방영권 판매 계약 ▲에이디엠코리아 재무구조 개선 목적 에이디엠바이오사이언스 지분 68 25억 원에 취득
 2022.01.11 14:34,"에스디바이오센서, 1008억 규모 자가검사키트 美 공급계약",글로벌 체외 진단 전문 기업 에스디바이오센서가 11일 1008억원 규모 코로나19 COVID 19 자가검사키트를 미국에 공급하는 대규모 계약을 체결했다고 밝혔다 이번 공급계약은 오미크론 변이 바이러스로 5차 대유행이 시작되자 미국 시장 내 코로나19 자가검사키트 수요가 급증한 데 따른 것이다 해당 코로나19 자가검사키트 COVID 19 At Home Test 는 지난달 24일 미국 식품의약처 FDA 로부터 긴급 사용승인을 획득한 제품으로 95 3 민감도와 100 의 특이도를 보였다 이번 계약으로 체결한 1008억원 규모의 코로나19 자가검사키트는 글로벌 진단 업체 A사에 공급된다 기존 자가검사키트는 영업권을 A사에 독점으로 부여하지 않음으로써 에스디바이오센서 브랜드와 A사 브랜드로 글로벌 시장을 장악해왔다 미국은 전략적으로 A사에 독점 유통권을 부여해 순조롭게 시장 진입을 꾀하겠다는 전략이다 허태영 에스디바이오센서 대표 이사는 뛰어난 품질력과 우수한 생산력이 뒷받침돼 FDA 긴급 사용승인을 획득한 지 3주도 채 안 된 시점에 큰 계약을 성공적으로 체결했다 며 2022년 에스디바이오센서는 미국을 포함한 전 세계 다양한 국가에 우수한 제품을 다양한 플랫폼으로 공급해 대한민국 바이오 업계의 위상을 드높일 수 있도록 노력하겠다 고 밝혔다
 2022.01.11 14:00,"에스디바이오센서, 1008억 규모 코로나 홈테스트 공급계약",에스디바이오센서는 미국 A사와 Standard Q Covid 19 At Hometest 공급계약을 체결했다고 11일 공시했다 계약금액은 1008억698만원으로 이는 2020년 매출 대비 5 98 에 해당하는 규모다 계약기간은 4월 30일까지다 회사 측은 경영상 비밀유지에 따라 계약상대는 비공개한다 고 밝혔다
 2022.01.07 08:01,"[우리는 이렇게 채용합니다] SD바이오센서 ""글로벌 무대에서 활약할 '열정' 인재 찾아요""",16일까지 창사 이래 최대 공채 모집글로벌 공략위해 영어 구술시험 기본SD바이오센서 오송 공장 전경 사진 제공 SD바이오센서 서울경제 코로나19 이후 글로벌 기업으로 도약하고 있는 SD바이오센서가 창사 이래 처음으로 대규모 공채를 실시한다 코로나19 체외진단으로 급성장한 SD바이오센서는 제약·바이오 업계에서 가장 적극적으로 투자하는 기업이 됐다 뛰어난 실적 덕에 업계 최고 수준의 연봉과 상여금은 물론 종합 건강검진 주택지원 대출제도 등 복지 혜택이 확대돼 구직자의 이목을 끈다 수원 본사를 기반으로 인도 인도네시아 미국 중국 브라질 등 많은 해외 법인을 거점으로 한 넓은 업무 영역이 특징이다 Q 이번 신입·경력 공채의 분야와 일정은지난 3일부터 시작해 오는 16일까지 접수한다 진행하는 첫 대규모 공개 채용으로 총 100명 이상을 채용할 계획이다 연구 마케팅 해외영업 국내영업 경영지원 생산 물류 등 다양한 분야가 채용 대상이다 학력 경력 그리고 우대사항은 직무마다 상이하며 자세한 내용은 채용 홈페이지에서 확인 가능하다 특히 올해는 연구소를 강화할 예정으로 연구 부문인 분자진단 센서개발 기기개발 등의 분야는 정해진 인원 없이 우수한 인재를 적극 영입한다 Q 채용 과정은일반적인 채용 과정은 서류전형 영어 구술시험 1차 면접 최종 면접 채용 검진 입사 순으로 진행된다 서류 전형에서 합격자는 영어 구술시험과 논술 및 1차 면접을 보게 된다 영어 구술시험은 유선으로 논술테스트는 1차 면접 시 약 30분 정도 진행한다 직무에 따라 1차 면접에서 PT면접을 추가로 진행하기도 한다 Q 채용 과정에서 특별한 점은글로벌 인재를 찾기 위해 채용 과정에서 다양한 노력을 하고 있다 외부에 보여지는 채용 과정에는 영어 구술시험 한 가지이지만 이는 하나의 지표일 뿐이다 외국어가 필요한 분야의 경우 1차 면접에서도 관련 질문을 통해 직무에 적합한 직원을 찾는다 SD바이오센서는 많은 해외 관계자들과 업무를 함께 진행하기 때문에 외국어를 유창하게 구사하는 것뿐만 아니라 다양한 문화에 대한 이해력을 갖춘 인재를 채용하기 위해 노력하고 있다 Q 서류 및 면접 전형에 꿀팁 이 있다면서류 전형에서는 지원 직무와의 적합성을 가장 중요하게 보고 있다 경력사원의 경우 자신이 그동안 해온 업무 및 성과를 직무 중심으로 기술하고 입사 후 본인이 어떻게 회사에 기여할 수 있는지를 구체적으로 포함하면 좋다 신입사원은 그간의 활동 내역과 지원동기 등이 담당직무와 일관되게 어떤 경험을 쌓아왔는지를 살펴본다 면접 전형은 면접관마다 중요하게 보는 포인트가 다르기 때문에 정해진 정답은 없다 다만 면접관은 사람을 보는 것에 있어 많은 경험과 노하우가 있는 전문가이기 때문에 능통한 말주변보다는 해당 직무를 위해 준비한 나의 노력과 입사 후 기여할 수 있는 부분을 자신감 있고 진솔하게 이야기하면 좋은 결과로 이어질 수 있다 Q SD바이오센서의 인재상은SD바이오센서의 인재상은 성실성 신뢰성 열정 적극성 팀워크이다 다섯 가지 모두 매우 중요한 요소이지만 그중에서 꼭 하나를 꼽자면 인류 건강에 기여하는 글로벌 1등 체외진단 기업의 목표를 함께 달성하기 위한 열정이다 SD바이오센서에는 바이오 관련 전공자가 많지만 그 외 다양한 전공 직원도 함께 근무하고 있다 글로벌 1등 체외진단 기업을 향해 도약할 SD바이오센서에서 성장하고 싶다면 전공과 상관없이 지원할 수 있다
 2022.01.03 17:42,[유가증권시장 공시] DL이앤씨 / 에스디바이오센서 / HDC현대산업개발,◇DL이앤씨 인천 도화1구역 재개발사업 4170억원 규모 수주 ◇에스디바이오센서 캐나다 기업과 387억원 코로나 진단키트 공급 계약 ◇HDC현대산업개발 1407억원 규모 공릉역세권 활성화사업 신축 공사
 2022.01.03 16:18,"에스디바이오센서, 캐다나에 1387억원 규모 코로나 진단키트 공급",에스디바이오센서는 캐나다 기업과 1387억원 규모의 코로나 자가진단키트 Standard Q Covid 19 Ag Nasal Test 공급계약을 체결했다고 3일 공시했다
 2022.01.03 10:34,"에스디바이오센서, 신입·경력 대규모 공채…100명 이상 뽑는다",체외진단 전문기업 에스디바이오센서는 오는 16일까지 2022년 신입·경력 직원을 대규모 공개 채용한다고 3일 밝혔다 에스디바이오센서는 코로나19 COVID 19 팬데믹 세계적 대유행 국면에서 주목받은 국내 대표 진단 기업 중 하나다 2020년 세계 최초로 코로나19 신속진단키트의 세계보건기구 WHO 긴급사용승인 EUL 을 받았다 2021년 코로나19 자가검사키트의 미국 FDA 식품의약국 긴급사용승인을 획득했다 뛰어난 품질과 우수한 생산력으로 지난해 3분기 기준 매출액 2조4800억원을 기록하는 등 실적 성장을 이어가고 있다고 설명했다 에스디바이오센서는 이번 공채를 통해 연구 마케팅 영업 경영지원 생산 등 다양한 분야에서 총 100명 이상을 채용한다 특히 연구 부문인 분자진단 센서개발 기기개발 분야는 정해진 인원 제한 없이 채용한다 에스디바이오센서는 우수 인재를 적극 영입해 연구 역량을 강화할 계획이다 입사지원서 접수는 이달 16일까지다 채용은 서류전형 영어 구술시험 1차 면접 최종 면접 채용 검진 순으로 진행한다 최종 합격자는 오는 3월 2일 입사한다 허태영 에스디바이오센서 대표는 공채를 통해 채용된 직원들이 빠르게 적응하고 성장할 수 있도록 회사 차원에서 전폭적인 지원을 아끼지 않을 것 이라며 글로벌 1위 체외진단기업으로 도약할 에스디바이오센서와 함께 미래로 나아가고자 하는 열정 가득한 우수 인재의 많은 지원을 바란다 고 말했다
 2021.12.31 11:00,내년 1월 3억1700만주 의무보유 풀린다…에스디바이오센서 가장 많아,한국예탁결제원은 내년 1월 중 에스디바이오센서 137310 등 상장사 46개사 주식 3억1742만주가 의무보유등록에서 해제된다고 31일 밝혔다 의무보유등록은 일반 투자자 보호를 위해 최대 주주 등이 소유한 주식을 일정 기간 예탁원에 처분이 제한되도록 전자 등록하는 제도다 진단키트 개발·제조업체인 에스디바이오센서 충북 오송 공장에서 29일 오전 약국과 인터넷 등을 통한 판매를 앞두고 최종 점검을 하고 있다 연합뉴스 시장별로 보면 유가증권시장에서 4개사 9230만주가 코스닥시장에서 42개사 2억2511만주가 의무보유등록이 풀린다 의무보유등록 해제 수량 상위 3개사는 에스디바이오센서 6639만주 참존글로벌 158310 4000만주 골드앤에스 035290 3400만주 다 발행 수량 대비 해제 수량의 비율이 높은 회사는 골드앤에스 93 9 참존글로벌 83 6 에스디바이오센서 64 3 순이다
 2021.12.30 17:25,"신성이엔지, 에스디바이오센서에 토지·건물·태양광발전소 299억 처분",이데일리 김영환 기자 신성이엔지 011930 는 에스디바이오센서 137310 에 충청북도 증평군 증평읍 미암리 1045번지 토지 건물 및 태양광발전소 설비를 처분한다고 30일 공시했다 처분금액은 298억8094만5872원으로 자산 총액 대비 7 06 다
 2021.12.28 08:19,"“에스디바이오센서, 코로나19 장기화로 진단 수요 증가”",케이프투자증권 분석케이프투자증권은 28일 에스디바이오센서에 대해 코로나19 확산 기간이 길어지며 진단 수요가 늘어났다며 목표주가를 7만6000원으로 높였다 주문자상표부착생산 OEM 계약을 체결한 로슈 제품의 미국 긴급사용승인 및 국제기구 FIND’를 통한 현장분자진단기기 공급 등도 긍정적인 요인으로 봤다 오승택 연구원은 “현재 세계적으로 코로나19 확산세가 지속 중이며 단계적 일상회복 위드코로나 은 일시 중지 상태”라며 “높은 백신 접종률에도 진단 수요는 꾸준히 발생할 것”이라고 말했다 로슈는 지난 24일 미국 식품의약국 FDA 으로부터 가정용 N 단백질 항원 진단키트인 COVID 19 At Home Test 에 대해 긴급사용승인을 받았다고 발표했다 에스디바이오센서가 OEM으로 로슈에 공급하는 제품이다 COVID 19 At Home Test는 별도의 진단 장비나 기술 없이도 코로나19 진단이 가능하다 오미크론 변이 등 세계보건기구 WHO 에서 지정한 모든 우려변이종 VOC 을 포함해 20분만에 코로나19 감염 여부를 알 수 있다 로슈는 내달부터 미국 전역의 약국 및 소매점을 통해 이 제품을 공급할 예정이다 에스디바이오센서의 현장분자진단제품인 스탠다드 M10 은 설치가 확대되고 있어 코로나19가 끝나도 활용될 것으로 봤다 M10은 최근 국제 분자진단 평가·공급기구인 FIND 의 진단 부문 프로젝트에 선정됐다 저소득 국가 및 유럽 지역을 중심으로 공급이 가속화될 것이란 전망이다 오 연구원은 “내년 실적의 핵심은 코로나19 상황이지만 장기적으로는 스탠다드 M10 설치와 체외진단 분야의 높아진 위상에 주목해야 한다”며 “매독 인체면역결핍바이러스 HIV 등 비 非 코로나19 제품으로 확장이 가능하다”고 했다 박인혁 기자
 2021.11.29 07:41,"[클릭 e종목]""SD바이오센서, 팬데믹 장기화...중장기 성장동력 확보 주목""",한국투자증권은 29일 에스디바이오센서에 대해 꺾이지 않는 코로나19로 인해 장기 성장동력 확보 기회가 생겼다고 평가했다 올해 7월 상장한 에스디바이오센서는 면역화학진단 분자진단 혈당측정 등의 진단 플랫폼을 갖고 있는 체외진단 전문기업이다 세계 최초로 메르스 에볼라 항원 진단제품을 출시하는 등 빠른 대응 능력을 보유하고 있다 코로나19 팬데믹 상황에서는 세계 최초로 코로나19 항원진단제품의 WHO 긴급사용승인을 획득했다 신속진단키트 Standard Q 를 중심으로 올해 3분기 누적 매출액 2조4862억원 영업이익 1조2162억원으로 전년동기대비 각각 69 6 70 4 증가한 실적을 올렸다 현재 에스디바이오센서는 현장분자진단 장비 M10과 추가 M A를 통한 중장기 성장을 추진 중이다 분자진단 장비 M10은 3분기에 출시됐으며 코로나19뿐 아니라 HIV HBV HCV 등 다양한 검사가 가능해 팬데믹 이후에도 수요 발생이 예상된다 소모품인 카트리지를 통해 지속적인 매출 증가 또한 가능하다 정송훈 한국투자증권 연구원은 에스디바이오센서는 9월에 연속혈당측정기 제조사 UXN을 11월에는 브라질의 체외진단업체 Eco Diagnostica를 인수했다 며 이를 통해 혈당측정사업 강화와 진단키트의 남미 진출 및 동물진단으로의 사업 확장이 예상된다 고 말했다 에스디바이오센서는 코로나19 키트 판매 호조와 공모자금 유입을 통해 3분기말 기준 약 1조2000억원의 M A 재원을 마련한 상태다 현금및 현금성자산 7065억원 단기금융상품 4732억언을 보유 중이다 제조·유통 등 해외진출을 위한 추가 M A에 대한 강한 의지를 갖고 있다 향후 공격적인 M A를 통한 장기 성장동력 확보가 기대된다 에스디바이오센서는 상장 후 백신 접종률 증가 경구용 치료제 개발 위드코로나로 인한 수익성 악화 및 장기 성장동력 부재 우려로 주가가 하락했다 하지만 M10과 추가 M A가 성공한다면 이러한 우려는 해소가 가능하다는 분석이 나온다 정송훈 연구원은 11월 국내에서 위드코로나가 시작된 후 확진자가 다시 증가하고 있다 며 최근 누 Nu B 1 1 529 변이가 출현하는 등 팬데믹은 예상보다 장기화될 수 있다 고 말했다 그는 앞서 언급한 중장기 성장동력을 위한 시간과 자금을 확보할 수 있다는 점에서 팬데믹 기간이 연장되는 만큼 에스디바이오센서의 수혜가 예상된다 고 덧붙였다
 2021.12.27 11:13,"에스디바이오센서, 자가검사키트 美FDA 긴급사용승인에 4%대 강세",에스디바이오센서가 코로나19 자가검사키트에 대한 미국 식품의약국 FDA 의 긴급사용승인을 받았다는 소식에 오름세다 12월 27일 오전 11시 02분 현재 에스디바이오센서는 전일 대비 4 44 오른 5만6400원에 거래 중이다 이날 에스디바이오센서는 지난 24일 현지시간 자사 코로나19 자가검사키트가 미 FDA로부터 긴급사용승인을 받았다고 밝혔다 이번 승인을 받은 자가검사키트는 개발 생산에 에스디바이오센서의 독자 기술이 적용된 것으로 글로벌 진단업체 A사에 제조업자개발생산 ODM 으로 제공하는 제품이다 에스디바이오센서 측은 검사키트에 대해 20분 이내에 오미크론 델타 변이 등을 포함한 코로나19 바이러스의 감염 여부를 빠르게 확인할 수 있는 것이 장점 이라고 설명했다
 2021.12.27 08:59,"“에스디바이오센서, M10 판매가 실적 지속을 위한 핵심”",NH투자증권 분석NH투자증권은 27일 에스디바이오센서에 대해 올 3분기 누적 실적이 제약·바이오 업종 내 최고 수준이지만 지속을 위해서는 분자진단 장비인 M10 판매가 중요하다고 했다 에스디바이오센서는 3분기 누적으로 매출 2조4862억원 및 영업이익 1조2162억원을 기록했다 작년 같은 기간 대비 매출과 영업이익은 각각 229 2 와 237 9 늘었다 코로나19 신속진단키트인 스탠다드Q’의 매출 비중이 90 수준이다 코로나19 이후의 실적 지속 불확실성을 보완할 필요가 있다는 분석이다 현장 POC 분자진단 플랫폼인 스탠다드 M10’의 성장이 특히 중요하다고 봤다 스탠다드 M10은 올해 5000대 및 내년 3만대 생산을 목표하고 있다 생산 목표를 달성하고 판매까지 이어진다면 실적에 대한 불확실성은 제거할 수 있다는 판단이다 시장조사기관인 마켓앤드마켓은 체외진단 시장의 규모가 지난해 780억달러 약 92조원 에서 2025년까지 966억달러 약 114조원 로 연평균 4 4 성장할 것으로 전망했다 박병국 연구원은 “스탠다드 M10으로 다른 질환에 대한 시장을 선점할 수 있는 과도기적 시점”이라며 “M10의 판매를 늘려 잠금 락인 효과를 통해 성과를 보여줘야 한다”고 말했다 그동안 확보한 현금으로 인수합병 M A 을 진행할 가능성도 높다고 봤다 연말까지 에스디바이오센서가 약 1조4000억원의 현금을 확보할 수 있을 것으로 예상했다 에스디바이오센서는 우선 세계 현지에서 진단기기 생산 및 유통이 가능한 기업들을 물색 중이다 박인혁 기자
 2021.12.21 16:56,"에스디바이오센서, 체외진단의료기기 제조품목 허가",이데일리 함지현 기자 에스디바이오센서 137310 는 식품의약안전처로부터 체외진단의료기기 제조품목 허가를 받았다고 21일 공시했다 해당 품목은 제품 기존 PCR 검사의 정확도는 유지하되 1시간 이내에 결과를 확인할 수 있는 현장분자진단기기다
