date,title,contents
 2021.07.14 17:33,"[시그널] SD바이오센서, 낮춘 공모가·높은 유통 비율···주가 호재-악재 상존",■19일 상장···3대 관전 포인트①SD바이오센서 상장일 유통비율 32 높은 편 SKIET 등 올해 대어보다는 높아②8 5만→5 2만···공모가 조정 호재PER 20배 적용땐 적정가 7 1만원③씨젠·휴마시스 등 비교기업 폭등 델타 변이 확산에 최소 상한가 기대 서울경제 편집자註 이 기사는 2021년 7월 14일 15 03 프리미엄 컨버전스 미디어 시그널 Signal 에 표출된 기사입니다 SD바이오센서의 상장 당일 유통 가능 주식 비율이 약 32 로 확정됐다 통상 유통 비율이 높은 기업들이 40 를 상회하는 것과 비교하면 낮은 편이지만 상장 이후 주가 흐름이 좋았던 기업공개 IPO 대어들과 비교해서는 다소 높은 편이다 다만 한 차례 공모가를 할인한 데다 최근 코로나19 델타 변이 바이러스가 확산되면서 상장 당일 주가가 공모가 대비 30 이상 오를 것이라는 기대도 나오고 있다 ① 상장 당일 유통 비율 32 ···IPO 大魚보다 높아14일 투자은행 IB 업계에 따르면 SD바이오센서의 상장 당일 19일 유통 가능 주식 수는 3 332만 9 123주로 분석된다 상장 예정 주식 수는 1억 327만 1 353주 전체 주식 중 32 27 가 상장 당일 주식시장에서 거래될 수 있다는 의미다 SD바이오센서는 기관투자가들에 1 007만 1 155주의 공모주를 나눠줬는데 6개월 확약을 제시한 기관에 19만 2 300주를 3개월 73만 9 800주 1개월 190만 9 600주 15일은 33만 2 693주를 최종 배정했다 32 27 의 유통 비율은 최근 상장한 오비고 47 74 이노뎁 52 72 에 비해서는 낮은 수준이다 하지만 코스피 상장 기업과 비교하면 낮지만은 않다는 평가가 나온다 올해 상장한 기업 중 IPO 대어로 꼽히는 SK아이이테크놀로지는 상장 당일 유통 비율이 15 04 였으며 상장 당일 따상 시초가가 공모가의 두 배 이후 상한가 ’을 달성한 SK바이오사이언스의 유통 비율은 11 63 였다 고경범 유안타증권 연구원은 이달 초 보고서를 통해 SD바이오센서의 상장일 유통 가능 물량을 27 4 로 추정했는데 당시 고 연구원은 “유통 비율이 IPO 종목 대비 높은 편으로 상장일 매도 물량이 주가 상승을 저해하는 유인이 될 수 있다”고 평가한 바 있다 ② 8 5만→5 2만 원으로 뚝’···공모가 조정은 호재SD바이오센서는 당초 공모가 6만 6 000 8만 5 000원으로 1 555만 2 900주를 공모할 계획이었다 공모가 기준 기업가치는 약 8조 8 000억 원 하지만 공모 흥행을 위해 공모가를 5만 2 000원으로 대폭 줄이는 승부수를 던졌고 결국 수요예측과 일반 청약에 흥행했다 1 100 대 1이 넘는 수요예측 경쟁률과 32조 원에 육박하는 일반 청약 증거금을 모은 것 SD바이오센서가 공모가를 낮춘 사이 코로나19 델타 변이 확산 등으로 확진자가 늘면서 공모가 할인이 공모주 투자자 수익으로 이어질 것이라는 기대도 나온다 한 공모주 투자자는 “SD바이오센서는 실적뿐 아니라 코로나19 테마로 주가가 오르내릴 것”이라며 “공모가 정정으로 청약 일정을 미루는 사이 코로나19가 확산했고 결국 코로나19 확산의 수혜를 받게 됐다”고 말했다 ③ 비교 기업 주가 폭등’···최소 상한가 기대특히 코로나19 델타 변이 확산으로 진단주들의 주가가 크게 오르면서 SD바이오센서의 주가가 공모가보다 최소 30 이상 오를 것이라는 기대가 나오고 있다 SD바이오센서는 씨젠·휴마시스·랩지노믹스·바이오니아 등 국내 상장사와 써모피셔·퍼킨엘머 등 해외 상장사의 주가를 기반으로 공모가를 산정했는데 최근 이들 기업의 주가가 말 그대로 폭등’했기 때문이다 SD바이오센서가 이들 주가를 기준으로 적용한 주가수익비율 PER 은 14 64 배 최근 씨젠 등 비교 기업의 주가가 크게 오르면서 20배 이상의 PER 적용이 가능하다는 분석도 나온다 20배의 PER을 적용한 SD바이오센서의 공모가는 6만 1 500 7만 1 000원 수준 SD바이오센서의 공모가가 5만 2 000원임을 고려할 때 공모가 대비 상한가 6만 7 600원 까지 주가 상승 여력이 있다는 분석이 나온다
 2021.07.13 13:40,'상장 임박' SD바이오센서…'양날의 검'된 코로나,코로나 종식 시 실적 급감 우려 체외진단 시장 성장 등은 호재 그래픽 비즈니스워치코로나 확산으로 감염 여부를 확인할 수 있는 체외진단 사업이 급부상했다 국산 코로나 진단키트는 전 세계에서 러브콜이 쏟아지며 불티나게 팔렸다 코로나 전부터 바이러스 진단키트 연구개발을 지속해왔던 기업들은 재빠른 진단키트 개발로 호황을 누리고 있다 국내 체외진단기기 전문기업 SD바이오센서는 이 기세를 몰아 기업공개 IPO 에 나섰다 하지만 코로나 종식 후에는 실적이 급감할 것이라는 우려도 있다 쉽지 않았던 상장 과정SD바이오센서는 지난 8일과 9일 일반인 대상 공모청약을 마쳤다 코스피 상장 예정일은 오는 16일이다 전체 공모 주식 1493만400주 중 447만9120주에 대한 일반인 공모청약에 약 31조9121억원이 몰렸다 경쟁률은 274 02대 1에 달했다 SD바이오센서의 상장 직후 시가총액은 5조3701억원이다 유가증권시장에서 체외진단기기 사업으로 큰 성공을 거둔 씨젠 시총의 4조6000억원을 훌쩍 뛰어넘는다 사실 SD바이오센서의 IPO 과정은 순탄치 않았다 앞서 금융감독원은 두 차례에 걸친 증권신고서 정정을 요구했다 이에 따라 SD바이오센서는 공모가를 6만6000 8만5000원에서 4만5000 5만2000원으로 낮췄다 진단키트 사업의 불확실성에 대한 우려로 공모가 거품 논란이 일어서다 결국 최종 공모가는 5만2000원으로 확정됐다 청약 당일에는 눈치싸움이 벌어졌다 청약 첫날 경쟁률은 30대 1이었다 백신 접종이 활성화하면서 조만간 코로나가 종식될 것이라는 기대감과 함께 진단키트 수요가 대폭 감소할 것이라는 전망이 나왔기 때문이다 하지만 갑자기 신규 확진자가 증가하고 델타 변이 바이러스까지 확산하면서 이튿날 청약에서는 경쟁에 불이 붙었다 코로나 지속 상장 초기 투자 집중투자자들의 관심은 상장 후 주가에 집중되고 있다 SD바이오센서의 올해 1분기 매출은 1조1791억원 영업이익은 5763억원 순이익 4375억원이었다 지난해 실적은 연매출 1조6861억원 영업이익 7383억원 순이익 6216억원이었다 올해 1분기 실적이 작년 한해 실적과 맞먹는 셈이다 SD바이오센서의 올해 전체 매출은 3조원을 넘어설 것으로 전망되고 있다 SD바이오센서에 비해 매출액이나 영업이익 규모가 작은 씨젠의 주가가 8만 9만원대인 만큼 상장 초기에는 많은 투자자들이 몰릴 것으로 보인다 다만 진단키트 관련주의 호재 여부는 코로나에 많은 영향을 받는다 이는 그만큼 리스크도 크다는 것을 의미한다 사진 SD바이오센서 홈페이지SD바이오센서의 지난해 매출액은 코로나 전인 2019년에 비해 2310 증가했다 매출 비중은 품목별로 △신속진단 84 6 △분자진단 6 5 △형광면역진단 5 3 △혈당측정기 BGMS 2 6 △기타 0 9 △효소면역진단 0 1 다 가장 많은 매출 비중을 차지하고 있는 신속진단 제품은 대부분 코로나 진단키트에서 발생한 매출이다 코로나 사태 초기에 국내에서는 허가가 나지 않았던 신속 자가진단키트가 유럽과 아시아 등에서 출시되면서 매출이 급격하게 늘었다 따라서 코로나가 종식되면 코로나 덕분에 늘어났던 매출은 줄어들 수밖에 없다 SD바이오센서 투자에 대한 우려의 목소리가 나오는 이유다 타 질병 관련 진단키트 수출 확대하지만 당분간 SD바이오센서의 흥행은 지속될 전망이다 특히 코로나 진단키트로 쌓은 신뢰도가 다른 제품에도 긍정적인 영향을 미치고 있다 SD바이오센서는 지난해부터 올해 1분기 사이에 MSF 국경없는의사회 미국 국제개발처 USAID 등과 총 4200만개의 말라리아 신속진단키트의 공급계약을 맺었다 SD바이오센서는 지난 2003년 중증 급성 호흡기 증후군 사스 SARS 진단키트를 시작으로 메르스 에볼라 지카 항원 진단시약을 최초로 개발하기도 했다 이밖에 인플루엔자 신종플루 뎅기열 등 진단키트도 판매하고 있다 SD바이오센서는 이번 IPO를 통해 확보한 자금을 바탕으로 인수·합병에 나서 신사업 기반을 마련할 계획이다 새로운 진단 플랫폼 회사를 인수 유통망을 확대하고 향후 제품 개발‧생산‧유통을 모두 아우르는 기업으로 성장하는 것이 목표다 현재 SD바이오센서는 유유제약과 해외 유통·수출 아이큐어와 국내 유통을 공동으로 진행하고 있다 이와 함께 전체 매출의 41 를 차지하고 있는 유럽 지역에도 생산‧판매 법인을 추가 설립할 계획이다 주목 받는 체외진단 시장체외진단기기 시장은 계속 성장하는 분야다 진단용 의료기기 중 체외진단기기 은 가장 시장규모가 가장 크다 시장 리서치 전문기관인 포춘 비즈니스 인사이트 Fortune Business Insights 에 따르면 글로벌 체외진단시장 규모는 지난 2018년 612억2000만달러에서 연평균 4 5 로 성장해 오는 2026년 871억1000만달러에 달할 전망이다 국내 체외진단기기 시장도 건강보험 적용 확대 정책 등으로 2013년부터 5년간 56 7 성장했다 기존 국내 제약바이오 기업들도 이 시장에 뛰어들고 있다 셀트리온은 코로나 확산 전인 2019년 정밀진료에 필요한 진단기기 개발 및 생산에 약 6조원을 투자할 것이라고 밝힌 바 있다 한독은 이달 초 체외진단기업 수젠텍과 알레르기 진단 제품에 대한 국내 판매 계약을 체결했다 대웅제약은 지난해 지노믹트리와 대장암 체외진단검사 얼리텍 의 국내 공동 판매 계약을 맺었다 제약업계 관계자는 코로나가 종식되면 매출에 심한 타격을 입겠지만 신종플루처럼 소멸되지 않고 고착화될 가능성이 있다 며 따라서 체외진단기기 시장은 제약바이오 기업들도 신사업으로 뛰어들 만큼 성장 가능성이 높다 고 말했다
 2021.07.11 17:53,‘진단키트 대어’ SD바이오센서 따상 갈까,코로나19 재확산에 흥행 기대감상장 직후 시총 5조3701억 예상기관 의무보유 확약물량 적은 편상장 초기 매도 이어질 가능성도 현장 체외진단 기업 SD바이오센서가 일반 공모주 청약 절차를 마치고 오는 16일 유가증권시장에 입성한다 코로나19 4차 대유행 영향으로 진단키트주가 다시 상승세에 오른 가운데 SD바이오센서도 상장 후 흥행을 이어갈지 주목된다 11일 금융감독원에 따르면 지난 9일 일반 공모주 청약을 마무리한 SD바이오센서의 평균 경쟁률은 274 02대 1에 달했다 청약이 흥행하면서 삼성증권 KB증권 등 일부 증권사에선 균등 배정으로 한 주도 받지 못하는 투자자도 나올 것으로 보인다 SD바이오센서의 시장 친화적 가격과 코로나19 확진 폭증세가 맞물리면서 기업공개 IPO 흥행을 이끌어냈다는 것이 증권업계의 평가다 이 회사는 지난 6월 29일 금감원의 증권신고서 정정 요구를 받고 공모가를 기존 대비 최대 39 나 낮춘 바 있다 코로나19 종식 기대감이 커지면서 공모가 고평가 논란 도 연이어 제기됐기 때문이다 그러나 최근 일일 확진자 수가 1000명을 넘고 주요 지역에 사회적 거리두기 4단계가 적용되는 등 코로나19가 재확산되면서 분위기는 급변했다 코로나19 진단키트를 핵심 수익원으로 둔 SD바이오센서의 실적이 예상보다 커지겠단 관측이 나온 것이다 SD바이오센서의 상장 직후 시가총액은 5조3701억원으로 4조6000억원대의 씨젠을 제치고 새로운 진단키트 대장주 가 될 전망이다 실제 회사는 작년 총 매출 1조6900억원 의 70 를 올해 1·4분기 3개월 만에 달성하는 등 견조한 실적을 기록하기도 했다 진단키트주 강세 분위기를 그대로 이어 상장 초기 흥행까지 가능하겠단 기대감이 나오는 이유다 다만 기관투자자 의무보유 확약 물량이 적은 점은 상장 초기 주가 변수로 꼽힌다 SD바이오센서의 확약 물량이 기관배정 물량의 12 4 에 불과하기 때문이다 앞서 SK아이이테크놀로지와 SK바이오사이언스의 확약 물량은 각각 기관배정 물량의 64 6 85 2 수준이었다 확약 비율이 적단 점은 그만큼 상장 초기에 쏟아질 수 있는 물량이 많다는 의미다 일각에서 주가 하방 압력이 커질 수 있단 우려도 나오는 이유다 SD바이오센서의 상장 첫날 유통 가능 물량은 전체 1억327만1353주 중 32 82 에 해당하는 3389만7561주다 고경범 유안타증권 연구원은 SD바이오센서의 상장일 유통가능 물량은 IPO 종목 대비 높은 편 이라며 상장일 매물출회로 주가상승을 저해하는 요인이 될 수 있다 고 내다봤다 이경준 혁신투자자문 대표는 SD바이오센서는 가치로 가기 보단 이슈 로 갈 종목 이라며 상장 즈음 코로나19 확산세 추이가 주가에도 영향을 미치겠지만 씨젠보다 훨씬 가격 메리트가 있고 유통 물량도 낮아 상대적으로 괜찮다고 보고 있다 고 말했다
 2021.07.09 16:52,"[마켓인]SD바이오센서, 청약경쟁률 274.02대 1… 증거금 32兆",8 9일 청약 증거금 약 31조9121억원 상장 후 적극적 소통 글로벌 기술력 강화 목표 16일 코스피 상장 예정 이데일리 권효중 기자 글로벌 현장 체외진단 전문 기업인 에스디 SD 바이오센서가 일반 공모 청약에서 경쟁률 274 02대 1을 기록 공모청약을 마감했다고 9일 밝혔다 에스디바이오센서는 지난 8일부터 이날까지 양일간 전체 공모 주식 1493만400주 중 30 에 해당하는 447만9120주에 대해 일반인 대상 공모청약을 진행했고 그 결과 공모 청약 증거금 약 31조 9121억원이 모였다고 밝혔다 앞서 청약 첫날이었던 지난 8일 경쟁률은 29 92대 1을 기록했다 이는 올해 대어였던 SK바이오사이언스 302440 75 87대 1 SK아이이테크놀로지 361610 78 93대 1 등에 비해 다소 저조한 수준이었다 첫날에는 총 1억3402만4630주의 신청이 접수됐고 이에 따른 증거금은 약 3조4846억원을 모았던 것이 청약 막바지 수요가 집중된 것으로 풀이된다 에스디바이오센서는 지난 5 6일 진행된 기관 대상 수요예측에서 총 1389곳의 기관이 참여 경쟁률 1143 76대 1을 기록 공모가를 희망 밴드 4만5000 5만2000원 최상단인 5만2000원으로 결정했다 이효근 에스디바이오센서 대표는 “글로벌 시장에서 인정받는 에스디바이오센서의 기술력에 대한 가치와 성장성을 믿고 이번 일반 공모 청약에 적극적으로 참여해준 개인 투자자분들께 감사드린다”며 “상장 이후에도 주주 분들과 적극적으로 소통하는 한편 의미있는 사업 성과를 보여 드릴 수 있도록 임직원 모두가 최선을 다하겠다”고 말했다 한편 에스디바이오센서의 상장 후 시가 총액 규모는 확정 공모가 기준 5조3701억원이며 이달 16일 유가증권시장에 상장될 예정이다
 2021.07.11 15:02,[금나와라 뚝딱]한숨 돌린 SD바이오센서…‘따상’ 가능할까,카뱅 크래프톤 IPO 슈퍼위크 앞두고 흥행 시금석 전망개인투자자 따상’ 기대감 속 낮은 확약률에 예측불가 이데일리 이지현 기자 기업공개 IPO 슈퍼위크를 앞두고 흥행 시금석이 될 것으로 전망된 에스디 SD 바이오센서가 공모청약을 마무리했습니다 경쟁률 274대 1로 일단 한숨을 돌린 모습입니다 이젠 상장 첫날로 시선이 옮겨갑니다 시초가가 공모가의 2배를 형성할 수 있을지 바로 상한가로 이어질 수 있을지 등에 대한 관심이 커지고 있습니다 결론부터 드리자면 현재로서는 알 수 없는 상황입니다 하지만 비슷한 사례를 통해 앞으로의 상황을 전망해보고자 합니다 첫날 청약 저조 분위기 둘째 날 반저11일 신속항원진단 키트 세계 1위 기업 에스디바이오센서는 지난 8일과 9일 양일간 전체 공모 주식 1493만400주 중 30 에 해당하는 447만9120주에 대해 일반인 대상 공모청약을 진행해 청약 증거금 약 31조9121억원을 모았다고 밝혔습니다 지난 5일과 6일 진행된 기관 대상 수요예측에서는 총 1389곳의 기관이 참여해 경쟁률 1143 76대 1을 기록하며 흥행을 예고했습니다 공모가도 희망 밴드 4만5000 5만2000원 최상단인 5만2000원으로 결정했습니다 이데일리 김다은 하지만 청약 첫날 경쟁률은 29 92대 1로 저조하자 흥행 먹구름이 꼈습니다 이는 올해 대어였던 SK바이오사이언스 302440 75 87대 1 SK아이이테크놀로지 361610 SKIET 78 93대 1 등과 비교해 다소 낮은 수준이었기 때문입니다 그런데 둘째날 상황이 반전됐습니다 누적 경쟁률은 274 02대 1까지 치솟았습니다 늦게까지 청약 여부를 고민하던 이들이 청약 둘째 날 오후에 대거 몰린 것으로 풀이됩니다 한 청약자는 “수요조사에서 기관 반응이 좋았고 공모가도 30 정도 낮춰 관심을 두고 있었다”며 “코로나19 4차 대유행이 시작한 만큼 진단키트 모멘텀이 당분간 지속할 거라는 생각에 청약했다”고 설명했습니다 다른 청약자는 “첫날 경쟁률이 낮아 청약을 하지 않으려 했다가 경쟁률이 200대 1일 넘어가는 걸 보고 청약을 했다”고 말했습니다 SKIET 해외 기관 매도 폭탄 그림자이제 고비를 넘긴 에스디바이오센서는 이제 두 번째 고비를 앞두고 있습니다 바로 SKIET가 넘지 못했던 따상’ 기록 도전입니다 에스디바이오센서는 16일 상장할 예정입니다 개장 전 동시호가에서 공모가의 2배인 10만4000원에 시초가가 형성돼 개장하자마자 상한가 30 까지 치솟는다면 소위 따상’을 기록할 수 있는 겁니다 현재 장외시장에서 에스디바이오센서는 9만7000원에 호가가 형성됐습니다 시초가가 공모가의 2배 정도 갈 거라는 믿음이 깔린 겁니다 표 이데일리직장인 커뮤니티인 블라인드에 한 투자자가 올린 설문에서도 투표참여자 104명 중 44명에 해당하는 42 5 가 첫날 상방의 흐름을 예상했습니다 따상’ 전망도 29 8 31명 나 됩니다 나머지는 하방 16 3 보합 11 5 을 택했습니다 개인투자자들은 첫날 기대감이 큰 것으로 보입니다 그런데 말입니다 앞서 상장한 SKIET의 사례를 보면 마음을 놓을 수만은 없습니다 지난 5월 상장하며 일반청약 경쟁률 288 17대 1로 청약증거금 81조원을 끌어모은 SKIET의 경우 시초가가 공모가의 2배에 형성하며 따상 기대감을 높였습니다 하지만 개장 30분도 되지 않아 매도 폭탄이 이어지며 상한가에 가보지도 못한 채 상장 첫날 26 하락했습니다 SKIET의 경우 기관투자자가 일정 기간 팔지 않겠다고 확약한 비율이 63 2 나 됐음에도 확약하지 않은 해외 기관투자자들이 매도폭탄을 내놓으며 하락을 부추긴겁니다 에스디바이오의 우려 점도 바로 이 부분입니다 기관투자자의 확약비율은 12 45 에 그치고 있습니다 국내기관 확약률은 △운용사 19 5 △투자매매·중개업자 18 9 △연기금·운용사 고유 97 로 집계됐습니다 공모주펀드나 하이일드펀드 말고는 확약을 거의 걸지 않은 셈입니다 해외 기관투자자 확약 비율은 0 6 에 불과합니다 이 같은 낮은 확약률은 첫날 매도물량 확대로 이어질 수 있습니다 특히 카카오뱅크 크래프톤 카카오페이로 이어지는 IPO 슈퍼위크를 앞두고 총알을 확보하려는 기관투자자들이 에스디바이오센서에서 장기투자하지 않을 거라는 관측이 지배적입니다 어찌 됐든 주사위는 던져졌습니다 에스디바이오센서의 상장 첫날 흥행 성적표는 이후 공모청약을 진행하는 맥스트 에브리봇 엠로 등 중소 IPO부터 카카오뱅크 크래프톤 카카오페이 등과 같은 대형 IPO까지 영향을 줄 거로 보입니다 한 증권투자업계 관계자는 “SKIET 상장 이후 공모주 청약시장 분위기가 많이 바뀐 게 사실”이라며 “에스디바이오센서의 상장 첫날 흥행 성적을 통해 이후 IPO 시장 분위기를 가늠할 수 있을 것”이라고 전망했습니다
 2021.07.11 09:41,[증시캘린더]이번주(7월 2주) 오비고·SD바이오센서 신규 상장 등,이데일리 유준하 기자 이번 주에는 오는 13일 미래차 소프트웨어 플랫폼 전문업체 오비고의 코스닥 상장 외에 의료기기 제조업체 에스디 SD 바이오센서가 오는 16일 코스피 시장에 신규 상장한다 이어 혈관질환 전문 바이오업체 큐라클의 공모청약이 예정돼 있다 다음은 이번 주 7월12 16일 주요 증시 일정이다 ◇ 7월12일 월 △맥스트 수요 예측 개시일 소프트웨어 개발 및 공급업 주당 공모 희망 범위는 1만1000 1만3000원 총 공모주식수는 100만주 이에 따른 공모금액은 110억 130억원 대표 주관사는 하나금융투자△세원이앤씨 091090 일반공모 증자 신주 상장 예정 신주 57만4712주 신규 상장 주당 발행가 1740원으로 자금조달 규모는 약 10억원△베노홀딩스 206400 제3자배정 유상증자 납입일 지난 4월 170억원 규모의 제3자배정 유상증자를 공시 1주당 발행가액은 5920원으로 발행대상자는 최대주주 제이앤제이인베스트먼트 등 보통주 287만1619주를 발행하며 이는 증자전 발행주식 총수 대비 12 5 ◇ 7월13일 화 △오비고 코스닥 신규 상장일 스마트카 소프트웨어 플랫폼 전문업체 확정공모가는 1만4300원으로 주당 공모 희망 범위 최상단 청약경쟁률은 1485대 1 총 공모주식수는 221만1820주 이에 따른 공모금액은 316억2900만원△에브리봇 수요 예측 개시일 가정용 기기 제조업 주당 공모 희망 범위는 3만2600 3만6700원 총 공모주식수는 112만주 이에 따른 공모금액은 365억 411억400만원 대표 주관사는 NH투자증권◇ 7월14일 수 △크래프톤 수요 예측 개시일 소프트웨어 개발 및 공급업 주당 공모 희망 범위는 40만 49만8000원 총 공모주식수는 865만4230주 이에 따른 공모금액은 3조4616억9200만 4조3098억654만원 대표 주관사는 미래에셋증권 NH투자증권 삼성증권 △투비소프트 079970 제3자배정 유상증자 납입일 지난 6일 10억원 규모의 제3자배정 유상증자를 정정 공시 1주당 발행가액은 2490원으로 발행대상자는 남궁현 씨 보통주 40만1606주를 발행하며 이는 증자전 발행주식 총수 대비 1 08 ◇ 7월15일 목 △신라젠 215600 제3자배정 유상증자 납입일 지난 5월 600억원 규모의 제3자배정 유상증자를 공시 1주당 발행가액은 3200원으로 발행대상자는 변경예정 최대주주인 엠투엔 보통주 1875만주를 발행하며 이는 증자전 발행주식 총수 대비 26 18 ◇ 7월16일 금 △에스디바이오센서 코스피 신규 상장일 의료기기 제조업체 확정 공모가 5만2000원으로 희망 공모 범위 최상단 청약 경쟁률은 274 02대 1 총 공모주식수는 1244만2200주 이에 따른 공모금액은 6469억9400만원
